{
  "$schema": "https://json-schema.org/draft/2020-12/schema",
  "title": "SPICT-4ALL Workflow Run Metadata",
  "type": "object",
  "required": ["run_id", "role", "status", "created_at_utc", "tool_version", "inputs"],
  "properties": {
    "run_id": {"type": "string", "pattern": "^[A-Za-z0-9][A-Za-z0-9._-]{0,99}$"},
    "role": {"type": "string", "minLength": 1},
    "status": {"enum": ["DRAFT", "FINAL"]},
    "created_at_utc": {"type": "string", "format": "date-time"},
    "tool_version": {"type": "string", "minLength": 1},
    "inputs": {
      "type": "array",
      "items": {
        "type": "object",
        "required": ["path", "sha256", "bytes"],
        "properties": {
          "path": {"type": "string", "minLength": 1},
          "sha256": {"type": "string", "pattern": "^[a-f0-9]{64}$"},
          "bytes": {"type": "integer", "minimum": 0}
        },
        "additionalProperties": false
      }
    }
  },
  "additionalProperties": false
}
